{
  "$schema": "https://json-schema.org/draft/2020-12/schema",
  "$id": "https://example.invalid/networklab/schemas/manifest/1.0",
  "title": "NetworkLab Manifest v1.0",
  "description": "Example and validation contract, not a claim about real measurements.",
  "type": "object",
  "additionalProperties": false,
  "required": [
    "schema_version",
    "report_type",
    "synthetic",
    "run_id",
    "run_uuid",
    "correlation_id",
    "role",
    "module_id",
    "scope_id",
    "target_id",
    "server_id",
    "profile",
    "started_at",
    "finished_at",
    "duration_ms",
    "status",
    "exit_code",
    "task_kind",
    "networklab_version",
    "requested_tests",
    "effective_parameters",
    "files",
    "errors",
    "warnings"
  ],
  "properties": {
    "schema_version": {
      "const": "1.0"
    },
    "synthetic": {
      "type": "boolean"
    },
    "run_id": {
      "type": "string",
      "pattern": "^\\d{4}-\\d{2}-\\d{2}-\\d{2}-\\d{2}-\\d{2}-[a-z0-9][a-z0-9-]*(?:-\\d{2})?$"
    },
    "run_uuid": {
      "type": "string",
      "pattern": "^[0-9a-f]{8}-[0-9a-f]{4}-4[0-9a-f]{3}-[89ab][0-9a-f]{3}-[0-9a-f]{12}$"
    },
    "correlation_id": {
      "type": [
        "string",
        "null"
      ],
      "pattern": "^[0-9a-f]{8}-[0-9a-f]{4}-4[0-9a-f]{3}-[89ab][0-9a-f]{3}-[0-9a-f]{12}$"
    },
    "role": {
      "enum": [
        "C",
        "S"
      ]
    },
    "module_id": {
      "enum": [
        "c-inventory",
        "c-standalone",
        "c-paired",
        "c-proxy",
        "c-collect",
        "s-inventory",
        "s-toolbox",
        "s-service",
        "s-scheduler"
      ]
    },
    "scope_id": {
      "type": "string",
      "pattern": "^[a-z0-9](?:[a-z0-9-]{0,61}[a-z0-9])?$"
    },
    "target_id": {
      "type": [
        "string",
        "null"
      ],
      "pattern": "^[a-z0-9](?:[a-z0-9-]{0,61}[a-z0-9])?$"
    },
    "server_id": {
      "type": [
        "string",
        "null"
      ],
      "pattern": "^[a-z0-9](?:[a-z0-9-]{0,61}[a-z0-9])?$"
    },
    "profile": {
      "enum": [
        "quick",
        "standard",
        "deep",
        null
      ]
    },
    "started_at": {
      "type": "string",
      "pattern": "^\\d{4}-\\d{2}-\\d{2}T\\d{2}:\\d{2}:\\d{2}\\+08:00$"
    },
    "finished_at": {
      "type": [
        "string",
        "null"
      ],
      "pattern": "^\\d{4}-\\d{2}-\\d{2}T\\d{2}:\\d{2}:\\d{2}\\+08:00$"
    },
    "duration_ms": {
      "type": [
        "integer",
        "null"
      ],
      "minimum": 0
    },
    "status": {
      "enum": [
        "completed",
        "failed",
        "timeout",
        "skipped",
        "interrupted",
        "partial",
        "not_implemented"
      ]
    },
    "exit_code": {
      "type": "integer",
      "minimum": 0,
      "maximum": 255
    },
    "report_type": {
      "const": "manifest"
    },
    "task_kind": {
      "enum": [
        "measurement",
        "transfer"
      ]
    },
    "networklab_version": {
      "type": "string",
      "minLength": 1
    },
    "requested_tests": {
      "type": "array",
      "items": {
        "type": "string",
        "pattern": "^[a-z0-9][a-z0-9-]*$"
      },
      "uniqueItems": true
    },
    "effective_parameters": {
      "type": "object"
    },
    "files": {
      "type": "array",
      "items": {
        "type": "object",
        "additionalProperties": false,
        "required": [
          "path",
          "kind",
          "format",
          "size_bytes",
          "sha256"
        ],
        "properties": {
          "path": {
            "type": "string",
            "pattern": "^[a-z0-9][a-z0-9._-]*$"
          },
          "kind": {
            "enum": [
              "summary",
              "raw",
              "stdout",
              "stderr",
              "other"
            ]
          },
          "format": {
            "enum": [
              "json",
              "ndjson",
              "csv",
              "txt",
              "flent",
              "binary",
              "other"
            ]
          },
          "size_bytes": {
            "type": "integer",
            "minimum": 0
          },
          "sha256": {
            "type": "string",
            "pattern": "^[0-9a-f]{64}$"
          },
          "test_id": {
            "type": [
              "string",
              "null"
            ],
            "pattern": "^[a-z0-9][a-z0-9-]*$"
          }
        }
      }
    },
    "errors": {
      "type": "array",
      "items": {
        "type": "object",
        "additionalProperties": false,
        "required": [
          "code",
          "message"
        ],
        "properties": {
          "code": {
            "type": "string",
            "minLength": 1
          },
          "message": {
            "type": "string",
            "minLength": 1
          },
          "test_id": {
            "type": [
              "string",
              "null"
            ]
          }
        }
      }
    },
    "warnings": {
      "type": "array",
      "items": {
        "type": "object",
        "additionalProperties": false,
        "required": [
          "code",
          "message"
        ],
        "properties": {
          "code": {
            "type": "string",
            "minLength": 1
          },
          "message": {
            "type": "string",
            "minLength": 1
          },
          "test_id": {
            "type": [
              "string",
              "null"
            ]
          }
        }
      }
    }
  }
}
